Job Title,Company,Experience,Location,Salary,Link,Skills
Senior Data Analyst - SQL,Black Turtle,"<span class=""ellipsis fleft fs12 lh16"" title=""4-6 Yrs "">4-6 Yrs</span>",Kolkata,Not disclosed,"=HYPERLINK(""https://www.naukri.com/job-listings-senior-data-analyst-sql-black-turtle-india-pvt-ltd-kolkata-4-to-6-years-310822907485"")","SQL, MS Excel, Project Management, PL SQL, VBA macros, Data Analytics, Analytics, Data Lake Technologies"
Data Analyst - Python/Artificial Intelligence,iMindYourBusiness,"<span class=""ellipsis fleft fs12 lh16"" title=""0-2 Yrs "">0-2 Yrs</span>","Kolkata, Mumbai, Hyderabad/Secunderabad, Pune, Chennai, Ahmedabad, Delhi / NCR, Bangalore/Bengaluru",Not disclosed,"=HYPERLINK(""https://www.naukri.com/job-listings-data-analyst-python-artificial-intelligence-imindyourbusiness-kolkata-mumbai-hyderabad-secunderabad-pune-chennai-ahmedabad-delhi-ncr-bangalore-bengaluru-0-to-2-years-290822904934"")","Data Analysis, Python, SQL server, C++, Advanced Excel, VBA, IT Skills, Data Science"
Data Analyst,Marriage On Mind,"<span class=""ellipsis fleft fs12 lh16"" title=""0-5 Yrs "">0-5 Yrs</span>","Kolkata, Indore, Hyderabad/Secunderabad, Pune, Ahmedabad, Chennai, Bangalore/Bengaluru, Delhi / NCR, Mumbai (All Areas)",Not disclosed,"=HYPERLINK(""https://www.naukri.com/job-listings-data-analyst-marriage-on-mind-kolkata-indore-hyderabad-secunderabad-pune-ahmedabad-chennai-bangalore-bengaluru-delhi-ncr-mumbai-all-areas-0-to-5-years-200722010262"")","SQL, python, C++, C, it, trainee, data analyst, bcom"
Data Analyst - FinTech,Primo Hiring,"<span class=""ellipsis fleft fs12 lh16"" title=""1-2 Yrs "">1-2 Yrs</span>","Kolkata, Mumbai, Hyderabad/Secunderabad, Pune, Chennai, Gurgaon/Gurugram, Delhi / NCR, Bangalore/Bengaluru",Not disclosed,"=HYPERLINK(""https://www.naukri.com/job-listings-data-analyst-fintech-primo-hiring-kolkata-mumbai-hyderabad-secunderabad-pune-chennai-gurgaon-gurugram-delhi-ncr-bangalore-bengaluru-1-to-2-years-310822905688"")","Data Analysis, SQL, Excel, SAS, XML, Javascript, SPSS"
Data Analyst - Java/Python,Career Infosystem,"<span class=""ellipsis fleft fs12 lh16"" title=""4-8 Yrs "">4-8 Yrs</span>","Kolkata, Mumbai, Hyderabad/Secunderabad, Pune, Ahmedabad, Chennai, Bangalore/Bengaluru, Delhi / NCR",Not disclosed,"=HYPERLINK(""https://www.naukri.com/job-listings-data-analyst-java-python-career-infosystem-kolkata-mumbai-hyderabad-secunderabad-pune-ahmedabad-chennai-bangalore-bengaluru-delhi-ncr-4-to-8-years-010922901797"")","Java, Database Design, Data Mining, IT Skills, Python, Oracle, Javascript, Tableau"
Data Analyst,Kissht,"<span class=""ellipsis fleft fs12 lh16 expwdth"" title=""2-5 Yrs "">2-5 Yrs</span>",Kolkata,"6,00,000 - 12,00,000 PA.","=HYPERLINK(""https://www.naukri.com/job-listings-data-analyst-si-creva-capital-services-private-limited-kolkata-2-to-5-years-230822003975"")","Statistical data, Analytical Skills, Risk Analysis, Data Modeling, Python, PowerBI, R Programming, and Data Visualization"
Business Data Analyst,Sterlite Technologies,"<span class=""ellipsis fleft fs12 lh16"" title=""5-10 Yrs "">5-10 Yrs</span>","Kolkata, Hyderabad/Secunderabad, Pune, Ahmedabad, Chennai, Bangalore/Bengaluru, Delhi / NCR, Mumbai (All Areas)","12,00,000 - 18,00,000 PA.","=HYPERLINK(""https://www.naukri.com/job-listings-business-data-analyst-sterlite-technologies-limited-kolkata-hyderabad-secunderabad-pune-ahmedabad-chennai-bangalore-bengaluru-delhi-ncr-mumbai-all-areas-5-to-10-years-260722009554"")","Domo, Business Intelligence Tools, sap, Data Management, business data analyst, Data Analysis, Data Mining, Tableau"
Data Analyst/developer - Sql/postgresql,Quantum Inventions Development Centre,"<span class=""ellipsis fleft fs12 lh16"" title=""2-7 Yrs "">2-7 Yrs</span>",Kolkata,Not disclosed,"=HYPERLINK(""https://www.naukri.com/job-listings-data-analyst-developer-sql-postgresql-quantum-inventions-development-centre-kolkata-2-to-7-years-010922900785"")","NoSQL, PostgreSQL, Hadoop, ETL, verbal, Python, written communication, Predictive Modelling"
Data Analyst - CRM Platform,Artech infosystem,"<span class=""ellipsis fleft fs12 lh16"" title=""1-6 Yrs "">1-6 Yrs</span>","Kolkata, Mumbai, Hyderabad/Secunderabad, Pune, Ahmedabad, Chennai, Delhi / NCR, Bangalore/Bengaluru",Not disclosed,"=HYPERLINK(""https://www.naukri.com/job-listings-data-analyst-crm-platform-artech-infosystem-kolkata-mumbai-hyderabad-secunderabad-pune-ahmedabad-chennai-delhi-ncr-bangalore-bengaluru-1-to-6-years-270722904483"")","CRM, Python, communication, analytical, data analytics, Java, SQL, C++"
Call For Clinical Data Analyst - Hyd/Bangalore/Pune/Mumbai/Kolkata,Cognizant,"<span class=""ellipsis fleft fs12 lh16"" title=""6-9 Yrs "">6-9 Yrs</span>","Kolkata, Hyderabad/Secunderabad, Pune, Bangalore/Bengaluru, Mumbai (All Areas)",Not disclosed,"=HYPERLINK(""https://www.naukri.com/job-listings-call-for-clinical-data-analyst-hyd-bangalore-pune-mumbai-kolkata-cognizant-technology-solutions-india-pvt-ltd-kolkata-hyderabad-secunderabad-pune-bangalore-bengaluru-mumbai-all-areas-6-to-9-years-250722005743"")","Medidata Rave, clinical data management"
Data Analyst,Tech Mahindra,"<span class=""ellipsis fleft fs12 lh16"" title=""4-9 Yrs "">4-9 Yrs</span>","Kolkata, Hyderabad/Secunderabad, Pune, Chennai, Bangalore/Bengaluru, Delhi / NCR, Mumbai (All Areas)",Not disclosed,"=HYPERLINK(""https://www.naukri.com/job-listings-data-analyst-tech-mahindra-ltd-kolkata-hyderabad-secunderabad-pune-chennai-bangalore-bengaluru-delhi-ncr-mumbai-all-areas-4-to-9-years-040822009614"")","Celonis, process mining, SQL, Data Science, python, data mining, Data Analysis, data engineering"
Business Data Analyst Big Data,Hykez Technologies India Pvt. Ltd.,"<span class=""ellipsis fleft fs12 lh16"" title=""3-8 Yrs "">3-8 Yrs</span>",Kolkata,Not disclosed,"=HYPERLINK(""https://www.naukri.com/job-listings-business-data-analyst-big-data-hykez-technologies-india-pvt-ltd-kolkata-3-to-8-years-150722502803"")","Business process, IIS, Change management, MySQL, SSRS, HTML, Apache, Troubleshooting"
Senior Data Analyst - SQL/Tableau,Global Employees,"<span class=""ellipsis fleft fs12 lh16"" title=""7-12 Yrs "">7-12 Yrs</span>","Kolkata, Mumbai, Hyderabad/Secunderabad, Pune, Bangalore/Bengaluru",Not disclosed,"=HYPERLINK(""https://www.naukri.com/job-listings-senior-data-analyst-sql-tableau-global-employees-kolkata-mumbai-hyderabad-secunderabad-pune-bangalore-bengaluru-7-to-12-years-120822907634"")","DATABASE, SQL, Tableau, communication, analytical, Advanced Excel, Business Intelligence, Excel"
Hiring For Clinical Data Management(Data Analyst/Team Lead),Manning Consulting,"<span class=""ellipsis fleft fs12 lh16"" title=""3-8 Yrs "">3-8 Yrs</span>","Kolkata, Mumbai, Hyderabad/Secunderabad, Pune, Bangalore/Bengaluru",Not disclosed,"=HYPERLINK(""https://www.naukri.com/job-listings-hiring-for-clinical-data-management-data-analyst-team-lead-manning-consulting-kolkata-mumbai-hyderabad-secunderabad-pune-bangalore-bengaluru-3-to-8-years-230822009838"")","Rava data, Clinical Data Management, Cdm"
Data Analyst,CINDREBAY SCHOOL OF FASHION & INTERIOR DESIGN,"<span class=""ellipsis fleft fs12 lh16"" title=""1-4 Yrs "">1-4 Yrs</span>","Kolkata, Hyderabad/Secunderabad, Coimbatore, Thodupuzha, Trivandrum/Thiruvananthapuram, Kochi/Cochin, Cannanore/Kannur, Indore, Nagpur, Pune, Lucknow, Calicut/Kozhikode, Bangalore/Bengaluru",Not disclosed,"=HYPERLINK(""https://www.naukri.com/job-listings-data-analyst-cindrebay-school-of-fashion-interior-design-hyderabad-secunderabad-coimbatore-thodupuzha-trivandrum-thiruvananthapuram-kochi-cochin-kolkata-cannanore-kannur-indore-nagpur-pune-lucknow-calicut-kozhikode-1-to-4-years-101221500466"")","Secondary Data, Database Design Development, Business Data Analyst, Data Collection Systems, Data Analysis, Data Mining, Information Management, Data Analytics"
Senior Data Analyst,sRide,"<span class=""ellipsis fleft fs12 lh16"" title=""3-8 Yrs "">3-8 Yrs</span>","Kolkata, Mumbai, New Delhi, Hyderabad/Secunderabad, Pune, Chennai",Not disclosed,"=HYPERLINK(""https://www.naukri.com/job-listings-senior-data-analyst-sride-carpool-kolkata-mumbai-new-delhi-hyderabad-secunderabad-pune-chennai-3-to-8-years-130622501501"")","Data analysis, Product engineering, HTML, Data Analyst, Business intelligence, Operations, SQL, Data extraction"
Data Analyst,Omnifin Solutions P Ltd,"<span class=""ellipsis fleft fs12 lh16"" title=""0-3 Yrs "">0-3 Yrs</span>","Kolkata, Bangalore/Bengaluru","2,00,000 - 3,75,000 PA.","=HYPERLINK(""https://www.naukri.com/job-listings-data-analyst-omnifin-solutions-p-ltd-kolkata-bangalore-bengaluru-0-to-3-years-220822009397"")","SQL, Advance Excel, BTech - IT, MySQL, ACL, MCA, Phython"
Data Analyst,ACZ Global Private Limited,"<span class=""ellipsis fleft fs12 lh16"" title=""2-6 Yrs "">2-6 Yrs</span>","Kolkata, Hyderabad/Secunderabad, Bangalore/Bengaluru",Not disclosed,"=HYPERLINK(""https://www.naukri.com/job-listings-data-analyst-acz-global-private-limited-kolkata-hyderabad-secunderabad-bangalore-bengaluru-2-to-6-years-030122603441"")","Word, Data analytics, PowerPoint, verbal, management, data visualisation, MS Visio, written"
Data Analyst,Vixplor Analytics,"<span class=""ellipsis fleft fs12 lh16"" title=""1-5 Yrs "">1-5 Yrs</span>",Kolkata,Not disclosed,"=HYPERLINK(""https://www.naukri.com/job-listings-data-analyst-vixplor-analytics-kolkata-1-to-5-years-301219501920"")","analytical, written communication, verbal, Computer science, Data collection, Packaging, Data analytics, Mathematics"
Data Analyst,EnergyTech Ventures,"<span class=""ellipsis fleft fs12 lh16"" title=""2-5 Yrs "">2-5 Yrs</span>",Kolkata,Not disclosed,"=HYPERLINK(""https://www.naukri.com/job-listings-data-analyst-energytech-ventures-kolkata-2-to-5-years-170120500029"")","Managed services, Excel, Process improvement, Data collection, HTTP, Data analytics, Data Analyst, Powerpoint"
Data Analyst,Enmay,"<span class=""ellipsis fleft fs12 lh16"" title=""1-6 Yrs "">1-6 Yrs</span>",Kolkata,Not disclosed,"=HYPERLINK(""https://www.naukri.com/job-listings-data-analyst-enmay-kolkata-1-to-6-years-101120501260"")","Data analysis, Data research, Social media, Data Analyst"
Data Analyst,Business Brio,"<span class=""ellipsis fleft fs12 lh16"" title=""1-3 Yrs "">1-3 Yrs</span>",Kolkata,Not disclosed,"=HYPERLINK(""https://www.naukri.com/job-listings-data-analyst-business-brio-kolkata-1-to-3-years-040121501561"")","Graphics, Minitab, Front end, RDBMS, MySQL, Workflow, SPSS, Macros"
Data Analyst (SQL + Python+Data Modeling),AddWiz Business Consulting,"<span class=""ellipsis fleft fs12 lh16"" title=""6-11 Yrs "">6-11 Yrs</span>","Kolkata, Mumbai, Visakhapatnam, Hyderabad/Secunderabad, Pune, Chennai, Ahmedabad, Delhi / NCR, Bangalore/Bengaluru",Not disclosed,"=HYPERLINK(""https://www.naukri.com/job-listings-data-analyst-sql-python-data-modeling-addwiz-business-consulting-kolkata-mumbai-visakhapatnam-vizag-hyderabad-secunderabad-pune-chennai-ahmedabad-delhi-ncr-bangalore-bengaluru-6-to-11-years-100822913926"")","Python, ETL, data modelling, SQL, IT Skills, Data Modeling"
Data Analyst,Maxura Academy,"<span class=""ellipsis fleft fs12 lh16"" title=""2-6 Yrs "">2-6 Yrs</span>",Kolkata,"3,50,000 - 7,50,000 PA.","=HYPERLINK(""https://www.naukri.com/job-listings-data-analyst-maxura-academy-kolkata-2-to-6-years-040822000111"")","Data Anlalytics, Research Analysis, Data Analysis"
Urgent Hiring# Data Analyst(XBRL Filling),Kredent Group,"<span class=""ellipsis fleft fs12 lh16"" title=""1-3 Yrs "">1-3 Yrs</span>",Kolkata,"3,00,000 - 6,00,000 PA.","=HYPERLINK(""https://www.naukri.com/job-listings-urgent-hiring-data-analyst-xbrl-filling-kredent-infoedge-pvt-ltd-kolkata-1-to-3-years-190822005911"")",Excel
OFRO Systems & Solutions Data Analyst,PwC,"<span class=""ellipsis fleft fs12 lh16"" title=""10-15 Yrs "">10-15 Yrs</span>","Kolkata, Hyderabad/Secunderabad, Bangalore/Bengaluru",Not disclosed,"=HYPERLINK(""https://www.naukri.com/job-listings-ofro-systems-solutions-data-analyst-pricewaterhousecoopers-service-delivery-center-kol-kata-private-limited-kolkata-hyderabad-secunderabad-bangalore-bengaluru-10-to-15-years-200822000920"")","Data Analysis, NoSQL, SSAS, Power BI, SSRS, data warehouse, SharePoint, SSIS"
Opening For Data Analysis Role | Big 4 MNC,CLARITY CONSULTING,"<span class=""ellipsis fleft fs12 lh16"" title=""8-12 Yrs "">8-12 Yrs</span>","Kolkata, Hyderabad/Secunderabad, Bangalore/Bengaluru",Not disclosed,"=HYPERLINK(""https://www.naukri.com/job-listings-opening-for-data-analysis-role-big-4-mnc-clarity-consulting-kolkata-hyderabad-secunderabad-bangalore-bengaluru-8-to-12-years-270822001668"")","data analysis, power bi, sql, SSAS, SSRS, JSON, SSIS, data warehouse"
Assistant Manager/Lead Assistant Manager/Manager- Data Analyst-Banking,Huquo Consulting Pvt. Ltd,"<span class=""ellipsis fleft fs12 lh16"" title=""2-7 Yrs "">2-7 Yrs</span>","Kolkata, Mumbai, Hyderabad/Secunderabad, Pune, Chennai, Ahmedabad, Bangalore/Bengaluru, Delhi / NCR",Not disclosed,"=HYPERLINK(""https://www.naukri.com/job-listings-assistant-manager-lead-assistant-manager-manager-data-analyst-banking-huquo-consulting-pvt-ltd-kolkata-mumbai-hyderabad-secunderabad-pune-chennai-ahmedabad-bangalore-bengaluru-delhi-ncr-2-to-7-years-180822905536"")","banking domain, SAS, Data Analytics, Analytics, Python"
SAP ERP Data Management Analyst- Sr. Associate,Best InfoSystems Ltd.,"<span class=""ellipsis fleft fs12 lh16"" title=""2-5 Yrs "">2-5 Yrs</span>","Kolkata, Chennai",Not disclosed,"=HYPERLINK(""https://www.naukri.com/job-listings-sap-erp-data-management-analyst-sr-associate-best-infosystems-ltd-kolkata-chennai-2-to-5-years-290822906699"")","SAP ERP, Finance, Focus, IT Skills, SAP, Data Management, Business Process, Data Analysis"
Lead Business Analyst,HomeLane,"<span class=""ellipsis fleft fs12 lh16"" title=""5-10 Yrs "">5-10 Yrs</span>","Kolkata, Hyderabad/Secunderabad, Pune, Chennai, Bangalore/Bengaluru, Delhi / NCR, Mumbai (All Areas)","15,00,000 - 27,50,000 PA.","=HYPERLINK(""https://www.naukri.com/job-listings-lead-business-analyst-homevista-decor-and-furnishings-private-ltd-kolkata-hyderabad-secunderabad-pune-chennai-bangalore-bengaluru-delhi-ncr-mumbai-all-areas-5-to-10-years-110822000876"")","sql, Excel, python, Business Analytics, business analysis, Business Optimization, analytics, r"
SAP ERP Data Management Analyst - Sr. Associate,Best Infosystems Ltd.,"<span class=""ellipsis fleft fs12 lh16"" title=""2-5 Yrs "">2-5 Yrs</span>","Kolkata, Chennai",Not disclosed,"=HYPERLINK(""https://www.naukri.com/job-listings-sap-erp-data-management-analyst-sr-associate-best-infosystems-ltd-kolkata-chennai-2-to-5-years-170822904193"")","ERP, SAP, Data Management, finance accounting, SAP Analytics Cloud"
Business Intelligence Analyst,GLOBAL UPSIDE India Pvt Ltd,"<span class=""ellipsis fleft fs12 lh16"" title=""2-7 Yrs "">2-7 Yrs</span>","Kolkata, Hyderabad/Secunderabad, Pune, Ahmedabad, Chennai, Bangalore/Bengaluru, Delhi / NCR, Mumbai (All Areas)","4,00,000 - 9,00,000 PA.","=HYPERLINK(""https://www.naukri.com/job-listings-business-intelligence-analyst-global-upside-india-pvt-ltd-kolkata-hyderabad-secunderabad-pune-ahmedabad-chennai-bangalore-bengaluru-delhi-ncr-mumbai-all-areas-2-to-7-years-050922007963"")","power bi, visualization, data analysis, Analytical, Bi, business intelligence, SQL"
Senior Data Scientist,RCPC,"<span class=""ellipsis fleft fs12 lh16"" title=""4-6 Yrs "">4-6 Yrs</span>","Kolkata, Mumbai, Hyderabad/Secunderabad, Lucknow, Chennai, Ahmedabad, Bangalore/Bengaluru, Delhi / NCR",Not disclosed,"=HYPERLINK(""https://www.naukri.com/job-listings-senior-data-scientist-rcpc-kolkata-mumbai-hyderabad-secunderabad-lucknow-chennai-ahmedabad-bangalore-bengaluru-delhi-ncr-4-to-6-years-170822904835"")","Python, IT Skills, Data Science, Machine Learning, statistical tests, data analysis, boosting, distance"
"Sr . Analyst , Transformation",Concentrix,"<span class=""ellipsis fleft fs12 lh16"" title=""2-6 Yrs "">2-6 Yrs</span>",Kolkata,Not disclosed,"=HYPERLINK(""https://www.naukri.com/job-listings-sr-analyst-transformation-concentrix-technologies-india-pvt-ltd-kolkata-2-to-6-years-290822501909"")","Microsoft Excel, written communication, Lean Six Sigma, business analysis, analytical, communication, verbal, Power Point Presentation"
Quality Analyst,Gruppent Solutions,"<span class=""ellipsis fleft fs12 lh16"" title=""0-5 Yrs "">0-5 Yrs</span>",Kolkata,Not disclosed,"=HYPERLINK(""https://www.naukri.com/job-listings-quality-analyst-gruppent-solutions-pvt-ltd-kolkata-0-to-5-years-130121500411"")","BPO, data analysis, Analytical skills, Call monitoring, Process orientation, Action plan, Process quality, Customer experience"
Business Analyst,Prime Infosoft,"<span class=""ellipsis fleft fs12 lh16"" title=""4-8 Yrs "">4-8 Yrs</span>","Kolkata, Mumbai, Hyderabad/Secunderabad, Pune, Chennai, Ahmedabad, Bangalore/Bengaluru, Delhi / NCR",Not disclosed,"=HYPERLINK(""https://www.naukri.com/job-listings-business-analyst-prime-infosoft-kolkata-mumbai-hyderabad-secunderabad-pune-chennai-ahmedabad-bangalore-bengaluru-delhi-ncr-4-to-8-years-260822907401"")","DATA ANALYST, analytical, Business analysis, SQL, Agile, Data Analysis, Business Analyst, Production Support"
Business Analyst,Zensar,"<span class=""ellipsis fleft fs12 lh16 expwdth"" title=""9-14 Yrs "">9-14 Yrs</span>","Kolkata, Hyderabad/Secunderabad, Pune, Bangalore/Bengaluru",Not disclosed,"=HYPERLINK(""https://www.naukri.com/job-listings-business-analyst-zensar-technologies-limited-kolkata-hyderabad-secunderabad-pune-bangalore-bengaluru-9-to-14-years-250822000837"")","Business Analytics, BA, Business Analysis"
Data Analytic | Fresher | Business Analytics,Creative Hands HR Consultancy,"<span class=""ellipsis fleft fs12 lh16"" title=""0-4 Yrs "">0-4 Yrs</span>","Kolkata, Hyderabad/Secunderabad, Ranchi, Chennai, Bangalore/Bengaluru, Mumbai (All Areas)","4,50,000 - 6,00,000 PA.","=HYPERLINK(""https://www.naukri.com/job-listings-data-analytic-fresher-business-analytics-creative-hands-hr-consultancy-kolkata-hyderabad-secunderabad-ranchi-chennai-bangalore-bengaluru-mumbai-all-areas-0-to-4-years-160522000552"")","Business Analytics, Data Analysis, Data Analytics, Analytical Skills, Data Analyst"
Data Scientist,Noble House Consulting India Private Limited,"<span class=""ellipsis fleft fs12 lh16"" title=""2-7 Yrs "">2-7 Yrs</span>","Kolkata, Pune, Chennai, Bangalore/Bengaluru, Delhi / NCR","15,00,000 - 25,00,000 PA.","=HYPERLINK(""https://www.naukri.com/job-listings-data-scientist-noble-house-consulting-india-private-limited-kolkata-pune-chennai-bangalore-bengaluru-delhi-ncr-2-to-7-years-040822006845"")","Machine Learning, Python, SQL, testing, Data Science, Data Engineering, data, Data Structures"
Opportunity @Freshers as a Accounts Admin/MIS Executive/Data Entry/WFH,ICONIC INFOTECH,"<span class=""ellipsis fleft fs12 lh16 expwdth"" title=""0-5 Yrs "">0-5 Yrs</span>","Kolkata, Noida, Bangalore/Bengaluru","2,00,000 - 4,00,000 PA.","=HYPERLINK(""https://www.naukri.com/job-listings-opportunity-freshers-as-a-accounts-admin-mis-executive-data-entry-wfh-iconic-infotech-noida-kolkata-bangalore-bengaluru-0-to-5-years-300822003373"")","back office, KPO, Inbound, blended process, BPO, Customer Service, Typing, cce"
Guidewire Business Analyst,HR Logica,"<span class=""ellipsis fleft fs12 lh16"" title=""5-10 Yrs "">5-10 Yrs</span>","Kolkata, Mumbai, Hyderabad/Secunderabad, Pune, Chennai, Gurgaon/Gurugram, Bangalore/Bengaluru",Not disclosed,"=HYPERLINK(""https://www.naukri.com/job-listings-guidewire-business-analyst-hr-logica-kolkata-mumbai-hyderabad-secunderabad-pune-chennai-gurgaon-gurugram-bangalore-bengaluru-5-to-10-years-200722903911"")","Guidewire, BA, data warehousing, ETL, SQL, GW, Business Analyst, Guidewire Business Analyst"
Business Analyst (Kolkata /WFH),Empower Recruitments,"<span class=""ellipsis fleft fs12 lh16"" title=""3-5 Yrs "">3-5 Yrs</span>",Kolkata,"4,50,000 - 8,00,000 PA.","=HYPERLINK(""https://www.naukri.com/job-listings-business-analyst-kolkata-wfh-empower-recruitments-kolkata-3-to-5-years-030922002081"")","Technology analyst, Business Analyst, Finance, BRD, Enterprise as product, agile, IT Skills, Cloud"
Business Analyst,EY,"<span class=""ellipsis fleft fs12 lh16"" title=""3-8 Yrs "">3-8 Yrs</span>","Kolkata, Kerala, India",Not disclosed,"=HYPERLINK(""https://www.naukri.com/job-listings-business-analyst-eygbs-india-llp-kolkata-kerala-india-3-to-8-years-020922007004"")","Business Analytics, SQL"
Business Analyst,Asconsoftech,"<span class=""ellipsis fleft fs12 lh16"" title=""5-8 Yrs "">5-8 Yrs</span>",Kolkata,Not disclosed,"=HYPERLINK(""https://www.naukri.com/job-listings-business-analyst-asconsoftech-kolkata-5-to-8-years-070122501360"")","Variance analysis, business analysis, data analytics, Excel, Pricing Analysis, Business Analyst, Management Accounting, Budgeting"
Senior Bioinformatics Statistical Analyst,ApicalGo Consultancy,"<span class=""ellipsis fleft fs12 lh16"" title=""1-6 Yrs "">1-6 Yrs</span>","Kolkata, Mumbai, Hyderabad/Secunderabad, Lucknow, Chennai, Ahmedabad, Delhi / NCR, Bangalore/Bengaluru",Not disclosed,"=HYPERLINK(""https://www.naukri.com/job-listings-senior-bioinformatics-statistical-analyst-apicalgo-consultancy-kolkata-mumbai-hyderabad-secunderabad-lucknow-chennai-ahmedabad-delhi-ncr-bangalore-bengaluru-1-to-6-years-220822901065"")","data analysis, Unix, Java, Perl, monitoring, analytical skills, MATLAB, Fortran"
MIS Executive and Business Analyst,Sanvie Retail Pvt Ltd,"<span class=""ellipsis fleft fs12 lh16"" title=""4-8 Yrs "">4-8 Yrs</span>",Kolkata(Syed Amir Ali Avenue),"3,00,000 - 4,50,000 PA.","=HYPERLINK(""https://www.naukri.com/job-listings-mis-executive-and-business-analyst-sanvie-retail-pvt-ltd-kolkata-4-to-8-years-200622005202"")","Macros, Pivot Table, hlookup, SUMIF, Countif, Concatenate, advanced excel, Conditional Formatting"
Service Delivery _ OSS _ Data Scientist,Ericsson,"<span class=""ellipsis fleft fs12 lh16"" title=""4-8 Yrs "">4-8 Yrs</span>",Kolkata,Not disclosed,"=HYPERLINK(""https://www.naukri.com/job-listings-service-delivery-oss-data-scientist-ericsson-india-global-services-pvt-ltd-kolkata-4-to-8-years-050522500411"")","Bidding, Data management, PHP, Google AdWords, HTML, microsoft, Data mining, Statistics"
Lead Product Analyst - Internet/Online/KPO,TalentStack,"<span class=""ellipsis fleft fs12 lh16"" title=""5-10 Yrs "">5-10 Yrs</span>","Kolkata, Mumbai, Hyderabad/Secunderabad, Pune, Chennai, Ahmedabad, Bangalore/Bengaluru, Delhi / NCR",Not disclosed,"=HYPERLINK(""https://www.naukri.com/job-listings-lead-product-analyst-internet-online-kpo-talentstack-kolkata-mumbai-hyderabad-secunderabad-pune-chennai-ahmedabad-bangalore-bengaluru-delhi-ncr-5-to-10-years-300822908621"")","Product Analytics, product design, Data Visualization, Tableau, Data Analytics, Statistics, Analytics, SQL"
Data Scientist Lead_Tata Consultancy Services(Tcs),TATA CONSULTANCY SERVICES (TCS),"<span class=""ellipsis fleft fs12 lh16"" title=""8-12 Yrs "">8-12 Yrs</span>","Kolkata, Hyderabad/Secunderabad, Chennai, Bangalore/Bengaluru",Not disclosed,"=HYPERLINK(""https://www.naukri.com/job-listings-data-scientist-lead-tata-consultancy-services-tcs-tata-consultancy-services-ltd-kolkata-hyderabad-secunderabad-chennai-bangalore-bengaluru-8-to-12-years-190822001529"")","Python, R Programming, IT Skills, Data Science, data scientist"
Data Scientist,Imurgence,"<span class=""ellipsis fleft fs12 lh16"" title=""2-4 Yrs "">2-4 Yrs</span>","Kolkata, Mumbai, Jamshedpur",Not disclosed,"=HYPERLINK(""https://www.naukri.com/job-listings-data-scientist-imurgence-kolkata-mumbai-jamshedpur-2-to-4-years-220221501627"")","Mining, Supply chain, Computer science, Data analysis, Operations research, Coding, Artificial Intelligence, Machine learning"
Sr. Officer / Assistant Manager Data Analytics,RSM,"<span class=""ellipsis fleft fs12 lh16"" title=""2-4 Yrs "">2-4 Yrs</span>","Kolkata, Mumbai, Gandhidham, Chennai, Bangalore/Bengaluru",Not disclosed,"=HYPERLINK(""https://www.naukri.com/job-listings-sr-officer-assistant-manager-data-analytics-rsm-kolkata-mumbai-gandhidham-chennai-bangalore-bengaluru-2-to-4-years-060622501133"")","Data analysis, Assurance, Manager Quality Assurance, cyber security, Data processing, Data quality, data visualization, Information technology"
Hiring For Big4 - Sr. Data Scientist,Contactx India,"<span class=""ellipsis fleft fs12 lh16"" title=""7-12 Yrs "">7-12 Yrs</span>","Kolkata, Mumbai, Hyderabad/Secunderabad, Lucknow, Chennai, Ahmedabad, Delhi / NCR, Bangalore/Bengaluru",Not disclosed,"=HYPERLINK(""https://www.naukri.com/job-listings-hiring-for-big4-sr-data-scientist-contactx-india-kolkata-mumbai-hyderabad-secunderabad-lucknow-chennai-ahmedabad-delhi-ncr-bangalore-bengaluru-7-to-12-years-280722901859"")","Credit Lending, Credit Strategy, Machine learning, SQL, SAS, Python, IT Skills, Model Deployment"
Data Scientist - Machine Learning,Corner Tree Consulting,"<span class=""ellipsis fleft fs12 lh16"" title=""6-10 Yrs "">6-10 Yrs</span>","Kolkata, Mumbai, Hyderabad/Secunderabad, Pune, Chennai, Ahmedabad, Delhi / NCR, Bangalore/Bengaluru",Not disclosed,"=HYPERLINK(""https://www.naukri.com/job-listings-data-scientist-machine-learning-corner-tree-consulting-kolkata-mumbai-hyderabad-secunderabad-pune-chennai-ahmedabad-delhi-ncr-bangalore-bengaluru-6-to-10-years-080822907588"")","Data Scientist, Time Series Analysis, Data Management, CICD, Azure IoT, Data Analytics, Machine learning, DevOps"
